id,name,programRuleVariableSourceType,valueType,useCodeForOptionSet,program,dataElement,trackedEntityAttribute,programStage,sharing
IRDehlkhE6C,NeoIPC NEC Pneumoperitoneum uint value,CALCULATED_VALUE,INTEGER_ZERO_OR_POSITIVE,False,D8mSSpOpsKj,,,,
ITr0HvRnBLm,NeoIPC HAP Secondary BSI pathogen 2 may be carbapenem-resistant,CALCULATED_VALUE,BOOLEAN,False,D8mSSpOpsKj,,,,
IYnf2xaWwh5,NeoIPC SSI Pathogen 1 may be MRSA,CALCULATED_VALUE,BOOLEAN,False,D8mSSpOpsKj,,,,
IzXLJyt4Wm1,NeoIPC NEC Increased gastric residuals uint value,CALCULATED_VALUE,INTEGER_ZERO_OR_POSITIVE,False,D8mSSpOpsKj,,,,
JA55RlDLzcr,NeoIPC HAP Fever uint value,CALCULATED_VALUE,INTEGER_ZERO_OR_POSITIVE,False,D8mSSpOpsKj,,,,
jdBBUrUlbbl,NeoIPC BSI Pathogen 2 may be VRE,CALCULATED_VALUE,BOOLEAN,False,D8mSSpOpsKj,,,,
JHPoW5JneeR,NeoIPC NEC Secondary BSI pathogen 2 may be MRSA,CALCULATED_VALUE,BOOLEAN,False,D8mSSpOpsKj,,,,
JIMyYTFhvlz,NeoIPC HAP Virus detected,CALCULATED_VALUE,BOOLEAN,False,D8mSSpOpsKj,,,,
Jis8LlKRMcC,NeoIPC SSI Pathogen 3 may be MRSA,CALCULATED_VALUE,BOOLEAN,False,D8mSSpOpsKj,,,,
jlt8WQXAJwv,NeoIPC BSI Pathogen 1 may be colistin-resistant,CALCULATED_VALUE,BOOLEAN,False,D8mSSpOpsKj,,,,
JoyNptaTejO,NeoIPC BSI Pathogen 1 may be MRSA,CALCULATED_VALUE,BOOLEAN,False,D8mSSpOpsKj,,,,
jy5nJ1kjHeq,NeoIPC SSI Pathogen 2 may be MRSA,CALCULATED_VALUE,BOOLEAN,False,D8mSSpOpsKj,,,,
kFeQ0QPnI33,NeoIPC BSI Pathogen 2 may be 3GCR,CALCULATED_VALUE,BOOLEAN,False,D8mSSpOpsKj,,,,
khxopMFeY20,NeoIPC HAP Pathogen 2 may be VRE,CALCULATED_VALUE,BOOLEAN,False,D8mSSpOpsKj,,,,
KLa6QnOUtWo,NeoIPC HAP Increased respiratory secretion uint value,CALCULATED_VALUE,INTEGER_ZERO_OR_POSITIVE,False,D8mSSpOpsKj,,,,
KS9VGqCaQLF,NeoIPC HAP Secondary BSI pathogen 1 may be 3GCR,CALCULATED_VALUE,BOOLEAN,False,D8mSSpOpsKj,,,,
l7yCryFJp7B,NeoIPC SSI Pathogen 2 may be carbapenem-resistant,CALCULATED_VALUE,BOOLEAN,False,D8mSSpOpsKj,,,,
LnaIK1cTjMk,NeoIPC HAP Secondary BSI pathogen 3 may be 3GCR,CALCULATED_VALUE,BOOLEAN,False,D8mSSpOpsKj,,,,
LpdvDoqxRQe,NeoIPC NEC Pneumatosis intestinalis imaging uint value,CALCULATED_VALUE,INTEGER_ZERO_OR_POSITIVE,False,D8mSSpOpsKj,,,,
M40DuS6evjz,NeoIPC NEC Fixed bowel loop uint value,CALCULATED_VALUE,INTEGER_ZERO_OR_POSITIVE,False,D8mSSpOpsKj,,,,
m55sz1I8LAT,NeoIPC HAP Pathogen 1 may be colistin-resistant,CALCULATED_VALUE,BOOLEAN,False,D8mSSpOpsKj,,,,
mAW7JgTrlDE,Pneumoperitoneum - count,CALCULATED_VALUE,INTEGER,False,D8mSSpOpsKj,,,,
MfqvyMrtTZq,NeoIPC HAP Pathogen 1 may be carbapenem-resistant,CALCULATED_VALUE,BOOLEAN,False,D8mSSpOpsKj,,,,
mgKF4es89FK,NeoIPC HAP Secondary BSI pathogen 3 may be VRE,CALCULATED_VALUE,BOOLEAN,False,D8mSSpOpsKj,,,,
n7qriBqSpw5,NeoIPC BSI Temperature count,CALCULATED_VALUE,INTEGER_ZERO_OR_POSITIVE,False,D8mSSpOpsKj,,,,
NbawR6SH3Q3,NeoIPC SSI Pathogen 3 may be carbapenem-resistant,CALCULATED_VALUE,BOOLEAN,False,D8mSSpOpsKj,,,,
nIC6ffCPGyZ,NeoIPC SSI Pathogen 1 may be VRE,CALCULATED_VALUE,BOOLEAN,False,D8mSSpOpsKj,,,,
NJSURN7DAGp,NeoIPC SSI Secondary BSI pathogen 2 may be MRSA,CALCULATED_VALUE,BOOLEAN,False,D8mSSpOpsKj,,,,
nLl9aH1VyU8,Pneumatosis intestinalis imaging - count,CALCULATED_VALUE,INTEGER,False,D8mSSpOpsKj,,,,
NrxeMjpOwCy,NeoIPC NEC Imaging findings total count,CALCULATED_VALUE,INTEGER_ZERO_OR_POSITIVE,False,D8mSSpOpsKj,,,,
nSLtlLrVUWU,NeoIPC BSI CRP count,CALCULATED_VALUE,INTEGER_ZERO_OR_POSITIVE,False,D8mSSpOpsKj,,,,
Nuhpo1PcZo0,NeoIPC HAP Pathogen 3 may be 3GCR,CALCULATED_VALUE,BOOLEAN,False,D8mSSpOpsKj,,,,
nxhErJYagAm,NeoIPC SSI Pathogen 3 may be colistin-resistant,CALCULATED_VALUE,BOOLEAN,False,D8mSSpOpsKj,,,,
o3ygjcUACTA,NeoIPC HAP Laboratory findings uint value,CALCULATED_VALUE,INTEGER_ZERO_OR_POSITIVE,False,D8mSSpOpsKj,,,,
OOJuuH46ztd,NeoIPC BSI Pathogen 1 is recognized pathogen,CALCULATED_VALUE,BOOLEAN,False,D8mSSpOpsKj,,,,
oXSjz4J8qhR,NeoIPC BSI White blood cell count count,CALCULATED_VALUE,INTEGER_ZERO_OR_POSITIVE,False,D8mSSpOpsKj,,,,
OZkwiIBx2MF,NeoIPC SSI Secondary BSI pathogen 2 may be VRE,CALCULATED_VALUE,BOOLEAN,False,D8mSSpOpsKj,,,,
PAb00mNSs0h,NeoIPC Patient Multiple birth value,TEI_ATTRIBUTE,TRUE_ONLY,False,D8mSSpOpsKj,,q2ijTWehrUh,,
pFFQSwwarEX,NeoIPC HAP Pathogen 1 may be MRSA,CALCULATED_VALUE,BOOLEAN,False,D8mSSpOpsKj,,,,
PoIRxHrUF0F,NeoIPC NEC Clinical findings total count,CALCULATED_VALUE,INTEGER_ZERO_OR_POSITIVE,False,D8mSSpOpsKj,,,,
PVjTrassrg4,NeoIPC NEC Secondary BSI pathogen 3 may be colistin-resistant,CALCULATED_VALUE,BOOLEAN,False,D8mSSpOpsKj,,,,
PvkYEF5HWGF,NeoIPC HAP Respiratory distress uint value,CALCULATED_VALUE,INTEGER_ZERO_OR_POSITIVE,False,D8mSSpOpsKj,,,,
PZKJK3fMNNw,NeoIPC NEC Secondary BSI pathogen 1 may be VRE,CALCULATED_VALUE,BOOLEAN,False,D8mSSpOpsKj,,,,
qL2Hc66TT0L,NeoIPC BSI Pathogen 2 may be carbapenem-resistant,CALCULATED_VALUE,BOOLEAN,False,D8mSSpOpsKj,,,,
QMxbqb2ii15,NeoIPC SSI Pathogen 3 may be 3GCR,CALCULATED_VALUE,BOOLEAN,False,D8mSSpOpsKj,,,,
qZuDWJlM1c0,NeoIPC BSI Acidosis count,CALCULATED_VALUE,INTEGER_ZERO_OR_POSITIVE,False,D8mSSpOpsKj,,,,
R1QYXtRAvzZ,NeoIPC HAP Secondary BSI pathogen 1 may be carbapenem-resistant,CALCULATED_VALUE,BOOLEAN,False,D8mSSpOpsKj,,,,
r8lJ0GRj2Pg,NeoIPC Admission Completed,CALCULATED_VALUE,BOOLEAN,False,D8mSSpOpsKj,,,,
Rucvktw1IvX,NeoIPC SSI Pathogen 1 may be colistin-resistant,CALCULATED_VALUE,BOOLEAN,False,D8mSSpOpsKj,,,,
rusECUNRcUp,NeoIPC Patient Total gestation days,CALCULATED_VALUE,INTEGER_ZERO_OR_POSITIVE,False,D8mSSpOpsKj,,,,
RwVBtoj0xgU,NeoIPC HAP Pathogen 1 is virus,CALCULATED_VALUE,BOOLEAN,False,D8mSSpOpsKj,,,,
SeMB2Z09hZl,NeoIPC BSI Common sepsis clinical findings count,CALCULATED_VALUE,INTEGER_ZERO_OR_POSITIVE,False,D8mSSpOpsKj,,,,
ShTsYB4H4Lo,NeoIPC BSI Procalcitonin count,CALCULATED_VALUE,INTEGER_ZERO_OR_POSITIVE,False,D8mSSpOpsKj,,,,
SlN8c44VJL4,NeoIPC NEC Surgical findings criterion fulfilled,CALCULATED_VALUE,BOOLEAN,False,D8mSSpOpsKj,,,,
SmRHypuemss,NeoIPC HAP Pathogen 3 is virus,CALCULATED_VALUE,BOOLEAN,False,D8mSSpOpsKj,,,,
SrThI1xjFSb,NeoIPC Patient Gestational age value,TEI_ATTRIBUTE,TEXT,False,D8mSSpOpsKj,,qLGOhTzMVyY,,
ssi2rkyC78K,NeoIPC SSI Pathogen 2 may be VRE,CALCULATED_VALUE,BOOLEAN,False,D8mSSpOpsKj,,,,
SuV8U7ppJfl,NeoIPC HAP Secondary BSI pathogen 3 may be carbapenem-resistant,CALCULATED_VALUE,BOOLEAN,False,D8mSSpOpsKj,,,,
sWWYX38PhNo,NeoIPC HAP Secondary BSI pathogen 3 may be MRSA,CALCULATED_VALUE,BOOLEAN,False,D8mSSpOpsKj,,,,
Tkq7HLswwTy,NeoIPC SSI Secondary BSI pathogen 1 may be 3GCR,CALCULATED_VALUE,BOOLEAN,False,D8mSSpOpsKj,,,,
tnbVpKEYO85,NeoIPC NEC Pneumatosis intestinalis surgical uint value,CALCULATED_VALUE,INTEGER_ZERO_OR_POSITIVE,False,D8mSSpOpsKj,,,,
tpL2MXeTMts,NeoIPC BSI Pathogen 3 may be VRE,CALCULATED_VALUE,BOOLEAN,False,D8mSSpOpsKj,,,,
TTHBd6wvOHs,NeoIPC HAP Secondary BSI pathogen 2 may be colistin-resistant,CALCULATED_VALUE,BOOLEAN,False,D8mSSpOpsKj,,,,
TYYw6pghREu,NeoIPC NEC Secondary BSI pathogen 1 may be MRSA,CALCULATED_VALUE,BOOLEAN,False,D8mSSpOpsKj,,,,
U1sSmGuRV67,NeoIPC NEC Secondary BSI pathogen 1 may be 3GCR,CALCULATED_VALUE,BOOLEAN,False,D8mSSpOpsKj,,,,
UcimqZVx1eT,NeoIPC BSI Irritability count,CALCULATED_VALUE,INTEGER_ZERO_OR_POSITIVE,False,D8mSSpOpsKj,,,,
uhqZ5LK1YcD,NeoIPC HAP Secondary BSI pathogen 2 may be VRE,CALCULATED_VALUE,BOOLEAN,False,D8mSSpOpsKj,,,,
ulqxi5y7GUi,NeoIPC HAP Bradycardia uint value,CALCULATED_VALUE,INTEGER_ZERO_OR_POSITIVE,False,D8mSSpOpsKj,,,,
UPdSfdruLxv,NeoIPC NEC Secondary BSI pathogen 2 may be carbapenem-resistant,CALCULATED_VALUE,BOOLEAN,False,D8mSSpOpsKj,,,,
UUMNUCwcy9G,NeoIPC NEC Vomiting uint value,CALCULATED_VALUE,INTEGER_ZERO_OR_POSITIVE,False,D8mSSpOpsKj,,,,
UVWRiTpklaz,NeoIPC SSI Pathogen 1 may be 3GCR,CALCULATED_VALUE,BOOLEAN,False,D8mSSpOpsKj,,,,
UwvpbUqVuKo,NeoIPC BSI Common sepsis total findings count,CALCULATED_VALUE,INTEGER_ZERO_OR_POSITIVE,False,D8mSSpOpsKj,,,,
UxQKelJGdwS,NeoIPC SSI Secondary BSI pathogen 3 may be MRSA,CALCULATED_VALUE,BOOLEAN,False,D8mSSpOpsKj,,,,
v0nORM8P6hp,NeoIPC BSI Common commensal once laboratory findings count,CALCULATED_VALUE,INTEGER_ZERO_OR_POSITIVE,False,D8mSSpOpsKj,,,,
v7lAgXhm432,NeoIPC BSI Pathogen 3 is recognized pathogen,CALCULATED_VALUE,BOOLEAN,False,D8mSSpOpsKj,,,,
VC71IWF5fTa,NeoIPC BSI Pathogen 3 may be 3GCR,CALCULATED_VALUE,BOOLEAN,False,D8mSSpOpsKj,,,,
Vd6FWrlPuXy,NeoIPC Patient Gestation weeks,CALCULATED_VALUE,INTEGER_ZERO_OR_POSITIVE,False,D8mSSpOpsKj,,,,
vfxHHCqlm8E,NeoIPC NEC Secondary BSI pathogen 2 may be VRE,CALCULATED_VALUE,BOOLEAN,False,D8mSSpOpsKj,,,,
VHlFFao70PY,NeoIPC HAP Secondary BSI pathogen 3 may be colistin-resistant,CALCULATED_VALUE,BOOLEAN,False,D8mSSpOpsKj,,,,
VkcLKzySw53,NeoIPC BSI Pathogen 3 may be colistin-resistant,CALCULATED_VALUE,BOOLEAN,False,D8mSSpOpsKj,,,,
w06601OEHyH,NeoIPC HAP Clinical criteria total count,CALCULATED_VALUE,INTEGER_ZERO_OR_POSITIVE,False,D8mSSpOpsKj,,,,
W2YeHUl261i,NeoIPC NEC Secondary BSI pathogen 3 may be 3GCR,CALCULATED_VALUE,BOOLEAN,False,D8mSSpOpsKj,,,,
wKlcfWtpJ38,NeoIPC NEC Abdominal discoloration uint value,CALCULATED_VALUE,INTEGER_ZERO_OR_POSITIVE,False,D8mSSpOpsKj,,,,
WNPBmincI8U,NeoIPC HAP Pathogen 2 may be colistin-resistant,CALCULATED_VALUE,BOOLEAN,False,D8mSSpOpsKj,,,,
wzjKQrcwLGf,NeoIPC BSI Pathogen 3 may be carbapenem-resistant,CALCULATED_VALUE,BOOLEAN,False,D8mSSpOpsKj,,,,
X7bwA8cyvOA,NeoIPC BSI IT ratio count,CALCULATED_VALUE,INTEGER_ZERO_OR_POSITIVE,False,D8mSSpOpsKj,,,,
Xbko4DoYD1Z,NeoIPC NEC Secondary BSI pathogen 1 may be colistin-resistant,CALCULATED_VALUE,BOOLEAN,False,D8mSSpOpsKj,,,,
xkY7Sq2Tufg,NeoIPC HAP Secondary BSI pathogen 2 may be MRSA,CALCULATED_VALUE,BOOLEAN,False,D8mSSpOpsKj,,,,
xRaEnfQER4n,Portal venous gas - count,CALCULATED_VALUE,INTEGER,False,D8mSSpOpsKj,,,,
xSPsu8Yx4mJ,NeoIPC NEC Blood in stool uint value,CALCULATED_VALUE,INTEGER_ZERO_OR_POSITIVE,False,D8mSSpOpsKj,,,,
XvCVf0JIua2,NeoIPC HAP Pathogen 3 may be MRSA,CALCULATED_VALUE,BOOLEAN,False,D8mSSpOpsKj,,,,
xyGksdbsIhP,NeoIPC HAP Pathogen 1 may be 3GCR,CALCULATED_VALUE,BOOLEAN,False,D8mSSpOpsKj,,,,
xYPaXDhIW2u,NeoIPC BSI Pathogen 2 may be colistin-resistant,CALCULATED_VALUE,BOOLEAN,False,D8mSSpOpsKj,,,,
xYyZ3Jni3Pc,NeoIPC BSI Common sepsis laboratory findings count,CALCULATED_VALUE,INTEGER_ZERO_OR_POSITIVE,False,D8mSSpOpsKj,,,,
YAfN58Kpoaj,NeoIPC BSI Feeding intolerance count,CALCULATED_VALUE,INTEGER_ZERO_OR_POSITIVE,False,D8mSSpOpsKj,,,,
yAXjPfru053,NeoIPC SSI Secondary BSI pathogen 1 may be carbapenem-resistant,CALCULATED_VALUE,BOOLEAN,False,D8mSSpOpsKj,,,,
YD7XNXtmbJq,NeoIPC BSI Apnoea count,CALCULATED_VALUE,INTEGER_ZERO_OR_POSITIVE,False,D8mSSpOpsKj,,,,
YyfjfhSnkTy,NeoIPC BSI Platelet count count,CALCULATED_VALUE,INTEGER_ZERO_OR_POSITIVE,False,D8mSSpOpsKj,,,,
Z5NgUsXUdFP,NeoIPC NEC Secondary BSI pathogen 3 may be VRE,CALCULATED_VALUE,BOOLEAN,False,D8mSSpOpsKj,,,,
ZHrUdSWRHAc,NeoIPC HAP Pathogen 2 may be MRSA,CALCULATED_VALUE,BOOLEAN,False,D8mSSpOpsKj,,,,
ZM6JQBJX0kM,NeoIPC HAP Pathogen detected in lower respiratory tract,CALCULATED_VALUE,BOOLEAN,False,D8mSSpOpsKj,,,,
ZmGktWABh6b,NeoIPC SSI Pathogen 3 may be VRE,CALCULATED_VALUE,BOOLEAN,False,D8mSSpOpsKj,,,,
zMNUn6D5196,NeoIPC BSI Pathogen 1 may be 3GCR,CALCULATED_VALUE,BOOLEAN,False,D8mSSpOpsKj,,,,
Zx7OqtIU4Os,NeoIPC HAP Pathogen 2 is virus,CALCULATED_VALUE,BOOLEAN,False,D8mSSpOpsKj,,,,
